word_english,translation_portuguese,sentence_english,sentence_portuguese,date
to break,romper,He decided to break with tradition and follow his own path in life.,Ele decidiu romper com a tradição e seguir o seu próprio caminho na vida.,2026-01-22
firing,demissão,"The manager's firing surprised the whole team, who did not expect this sudden change.","A demissão do gerente surpreendeu toda a equipa, que não esperava essa mudança repentina.",2026-01-22
just kidding,estou a brincar,"When I said I wasn't coming to the party, I was just kidding; of course I'm going to show up.","Quando disse que não vinha à festa, estava a brincar, claro que vou aparecer.",2026-01-22
take off,decolar,"The plane will take off in ten minutes, so get ready for the trip.","O avião vai decolar em dez minutos, por isso prepara-te para a viagem.",2026-01-22
pigeon,pombo,The pigeon landed gently on the window while I was having breakfast.,O pombo pousou suavemente na janela enquanto eu tomava café da manhã.,2026-01-22
Waxine lights,Velas de cera,Waxine lights are perfect for creating a cozy atmosphere at home.,As velas de cera são perfeitas para criar uma atmosfera acolhedora em casa.,2026-01-22
Black table,Mesa preta,The black table in the dining room goes well with the white chairs we chose.,A mesa preta na sala de jantar combina bem com as cadeiras brancas que escolhemos.,2026-01-22
keys,chaves,The house keys are always in the same drawer in the kitchen.,As chaves da casa estão sempre na mesma gaveta da cozinha.,2026-01-22
Access,Aceder,"To access the site, you need a stable internet connection.","Para aceder ao site, precisas de uma ligação à internet estável.",2026-01-22
Cookies,Bolachas,The cookies you made are delicious and disappeared in a few minutes.,As bolachas que fizeste estão deliciosas e desapareceram em poucos minutos.,2026-01-22
toothpicks,palitos de dentes,"After dinner, I used toothpicks to clean between my teeth.","Depois do jantar, usei palitos de dentes para limpar os dentes entre as refeições.",2026-01-22
friction,fricção,The friction between the two materials caused significant wear over time.,A fricção entre os dois materiais causou um desgaste significativo ao longo do tempo.,2026-01-22
Screen,Ecrã,The screen of my computer needs a thorough cleaning to see better.,O ecrã do meu computador está a precisar de uma limpeza urgente para ver melhor.,2026-01-22
spending,gasto,Your monthly spending on food is very high; you should try to save a bit more.,"O teu gasto mensal com comida é muito elevado, deves tentar poupar um pouco mais.",2026-01-22
I've got you under my skin,Estás na minha pele,"The truth is that since I met you, you feel under my skin in a unique way.","A verdade é que, desde que te conheci, sentes-te na minha pele de uma forma única.",2026-01-22
understanding,compreensão,Mutual understanding is essential for resolving conflicts and building healthy relationships.,A compreensão mútua é essencial para resolver conflitos e construir relacionamentos saudáveis.,2026-01-22
1991,1991,"In 1991, Portugal experienced significant moments in its recent history, such as joining the European Union.","Em 1991, Portugal viveu momentos marcantes na sua história recente, como a adesão à União Europeia.",2026-01-22
Seat,Assento,The bus seat was comfortable and allowed me to relax during the trip.,O assento do autocarro estava confortável e permitiu-me relaxar durante a viagem.,2026-01-22
job offer,oferta de emprego,I received a job offer that seems to be a great opportunity for my career.,Recebi uma oferta de emprego que parece ser uma ótima oportunidade para a minha carreira.,2026-01-22
office,escritório,The office where I work is very comfortable and has an amazing view of the city.,O escritório onde trabalho é muito confortável e tem uma vista incrível para a cidade.,2026-01-22
Flute,Flauta,The flute is a musical instrument that produces soft and melodic sounds.,A flauta é um instrumento musical que produz sons suaves e melodiosos.,2026-01-22
Stamps,Selos,Stamps are essential for sending letters and postcards by mail.,Os selos são essenciais para enviar cartas e postais pelo correio.,2026-01-22
relocation,realojamento,The relocation of families affected by the fire was a priority for the municipal council.,O realojamento das famílias afetadas pelo incêndio foi uma prioridade para a câmara municipal.,2026-01-22
request,peça,You can make a request to the manager for him to consider your suggestion.,Podes fazer uma peça ao gerente para que ele considere a tua sugestão.,2026-01-22
desk,secretária,The desk is full of papers and books that I need to organize today.,A secretária está cheia de papéis e livros que preciso organizar hoje.,2026-01-22
Duck,Pato,The duck was swimming peacefully in the lake while the younger ducks followed it.,O pato nadava tranquilamente no lago enquanto os patos mais novos o seguiam.,2026-01-22
part-time job,trabalho a tempo parcial,I was looking for a part-time job to supplement my monthly income.,Estava à procura de um trabalho a tempo parcial para complementar a minha renda mensal.,2026-01-22
job fair,feira de emprego,This year's job fair will have several companies looking for new talent.,A feira de emprego deste ano terá várias empresas à procura de novos talentos.,2026-01-22
stamps,selos,The stamps I bought at the store are very beautiful and have interesting designs.,Os selos que comprei na loja são muito bonitos e têm designs interessantes.,2026-01-22
work office,escritório de trabalho,The work office is always full of people discussing projects and collaborating as a team.,O escritório de trabalho está sempre cheio de pessoas a discutir projetos e a colaborar em equipa.,2026-01-22
lid,tampo,"The lid of the box was loose, so I had to tighten it so it wouldn't fall off.","O tampo da caixa estava solto, então tive de apertá-lo para que não caísse.",2026-01-22
piece,peça,I need a new piece for my car because the old one broke down.,"Preciso de uma peça nova para o meu carro, pois a antiga avariou.",2026-01-22
invitation,convite,I received an invitation to my friend's birthday party this weekend.,Recebi um convite para a festa de aniversário do meu amigo este fim de semana.,2026-01-22
excerpt,excerto,The excerpt from the book I read yesterday made me think about life and its choices.,O excerto do livro que li ontem deixou-me a pensar sobre a vida e as suas escolhas.,2026-01-22
need,precisar,"Sometimes, we need help to solve problems that seem impossible to overcome.","Às vezes, precisamos de ajuda para resolver problemas que parecem impossíveis de ultrapassar.",2026-01-22
Watchers,Observadores,The nature watchers noticed significant changes in animal behavior this year.,Os observadores da natureza notaram mudanças significativas no comportamento dos animais este ano.,2026-01-22
Cozy,Aconchegante,The living room was so cozy that I didn't want to leave it all night.,A sala estava tão aconchegante que não queria sair de lá durante a noite.,2026-01-22
refusal,recuso,The refusal to accept the proposal left everyone surprised by his decision.,O recuso de aceitar a proposta deixou todos surpresos com a sua decisão.,2026-01-22
take in,absorver,It is important to take in new information to stay updated in your job.,É importante absorver novas informações para te manteres atualizado no teu trabalho.,2026-01-22
Mortgage,Hipoteca,"When you decide to buy a house, it's important to understand how the mortgage works.","Quando decidires comprar uma casa, é importante entender como funciona a hipoteca.",2026-01-22
steering wheel,volante,"The car's steering wheel was dirty, so I decided to clean it before driving.","O volante do carro estava sujo, então decidi limpá-lo antes de conduzir.",2026-01-22
Gloves,Luvas,"In winter, it's important to wear gloves to keep your hands warm while walking on the street.","No inverno, é importante usar luvas para manter as mãos quentes enquanto andas na rua.",2026-01-22
alluding,aludindo,He was alluding to a past event that we all know well.,Ele estava aludindo a um evento passado que todos conhecemos bem.,2026-01-22
gifts,prendas,"At Christmas, we usually exchange gifts among friends and family to celebrate the festive season.","No Natal, costumamos trocar prendas entre amigos e familiares para celebrar a época festiva.",2026-01-22
vacuum cleaner,aspirador,The vacuum cleaner is essential for keeping the house clean and free of dust and dirt.,O aspirador é essencial para manter a casa limpa e livre de pó e sujidade.,2026-01-22
Timeless,Intemporal,The song you heard yesterday is timeless and continues to touch my heart.,A música que ouviste ontem é intemporal e continua a tocar no meu coração.,2026-01-22
to relax,folgar,"After a tiring week, it's nice to relax and enjoy the weekend with friends.","Depois de uma semana cansativa, é bom folgar e aproveitar o fim de semana com amigos.",2026-01-22
Gifts,Prendas,Christmas gifts are always a pleasant surprise for all family members.,As prendas de Natal são sempre uma surpresa agradável para todos os membros da família.,2026-01-22
locks,fechaduras,The locks on the house doors are very old and need to be replaced.,As fechaduras das portas da casa são muito antigas e precisam de ser substituídas.,2026-01-22
chest,peito,He lifted his shirt and showed his chest full of tattoos.,Ele levantou a camisa e mostrou o peito cheio de tatuagens.,2026-01-22
biceps,bíceps,Doing exercises for the biceps is important for having strength in the arms.,Fazer exercícios para os bíceps é importante para ter força nos braços.,2026-01-22
surrounded,rodeado,I feel surrounded by friends who support me in all difficult moments.,Sinto-me rodeado de amigos que me apoiam em todos os momentos difíceis.,2026-01-22
besides,além disso,"Besides, we need to consider other options before making a final decision.","Além disso, precisamos considerar outras opções antes de tomar uma decisão final.",2026-01-22
put away,guardar,"After using the dishes, it's important to put them away properly in the cupboard.","Depois de usar os pratos, é importante guardá-los corretamente no armário.",2026-01-22
to roll,enrolar,He decided to roll up the towel before leaving the pool to avoid getting it wet.,Ele decidiu enrolar a toalha antes de sair da piscina para não a molhar.,2026-01-22
pointed,apontado,His finger was pointed in the right direction during the discussion.,O dedo dele estava apontado para a direção certa durante a discussão.,2026-01-22
chewing gum,goma de mascar,I bought a pack of chewing gum to freshen my breath after lunch.,Comprei uma embalagem de goma de mascar para refrescar o hálito depois do almoço.,2026-01-22
dry run,ensaio,We did a dry run to ensure everything goes well on the day of the presentation.,Fizemos um ensaio para garantir que tudo corre bem no dia da apresentação.,2026-01-22
stairs,escadas,The stairs in the building are very steep and can be dangerous for some people.,As escadas do prédio são muito íngremes e podem ser perigosas para algumas pessoas.,2026-01-22
statue,estátua,The statue in the park is a tribute to the city's heroes.,A estátua no parque é uma homenagem aos heróis da cidade.,2026-01-22
soaking wet,encharcado,"After the heavy rain, I got home completely soaking wet and in need of a towel.","Depois da chuva intensa, cheguei a casa completamente encharcado e a precisar de uma toalha.",2026-01-22
lobby,lobby,"The lobby is an important part of the political process, where decisions and policies are influenced.","O lobby é uma parte importante do processo político, onde se influenciam decisões e políticas.",2026-01-22
scam,golpe,"Be careful with emails that seem legitimate, many are scams to steal personal information.","Cuidado com os e-mails que parecem legítimos, muitos são golpes para roubar informações pessoais.",2026-01-22
fraud,fraude,Financial fraud can have serious consequences for victims and for society.,A fraude financeira pode ter consequências graves para as vítimas e para a sociedade.,2026-01-22
under construction,em construção,The new shopping center is under construction and is expected to open next year.,O novo centro comercial está em construção e deve abrir no próximo ano.,2026-01-22
refugee,refugiado,The refugee found shelter in an organization that helps people in crisis situations.,O refugiado encontrou abrigo numa organização que ajuda pessoas em situações de crise.,2026-01-22
axe,machado,The axe is an essential tool for chopping wood and making fire.,O machado é uma ferramenta essencial para cortar madeira e fazer fogo.,2026-01-22
stoned,chapado,"After smoking a bit, he got completely stoned and couldn't stop laughing.","Depois de fumar um pouco, ele ficou completamente chapado e não conseguia parar de rir.",2026-01-22
Dawn,Amanhecer,Dawn is always a magical moment when the light begins to illuminate the sky.,"O amanhecer é sempre um momento mágico, quando a luz começa a iluminar o céu.",2026-01-22
Harvest,Colheita,"The grape harvest this year was exceptional, with a quality above average.","A colheita das uvas este ano foi excepcional, com uma qualidade superior à média.",2026-01-22
Wind,Vento,"The wind was blowing hard, making the trees sway and the leaves fall.","O vento soprava forte, fazendo as árvores balançarem e as folhas caírem.",2026-01-22
waisted,com cintura,The blouse I bought is very pretty and has a waisted cut that flatters the body.,A blusa que comprei é muito bonita e tem um corte com cintura que valoriza o corpo.,2026-01-22
drunk,bêbado,"After a few beers, he got completely drunk and started telling funny stories.","Depois de algumas cervejas, ele ficou completamente bêbado e começou a contar histórias engraçadas.",2026-01-22
mess up,estragar,"If you don't pay attention, you might mess up everything you planned for the weekend.","Se não prestares atenção, podes estragar tudo o que planeaste para o fim de semana.",2026-01-22
what,o que,"I don't understand what you're trying to say, can you explain better?","Não percebo o que estás a tentar dizer, podes explicar melhor?",2026-01-22
to mess up,trapalhar,"I don't want to mess up your work, but I need help with this task.","Não quero trapalhar o teu trabalho, mas preciso de ajuda com esta tarefa.",2026-01-22
tools,ferramentas,The right tools can make all the difference when it comes to completing a project.,As ferramentas certas podem fazer toda a diferença na hora de realizar um projeto.,2026-01-22
Scene,Cena,The scene in the movie was so thrilling that everyone was silent watching.,A cena do filme foi tão emocionante que todos ficaram em silêncio a assistir.,2026-01-22
Heartbroken,Coração partido,"After everything that happened, I feel heartbroken and don't know what to do.","Depois de tudo o que aconteceu, sinto-me com o coração partido e sem saber o que fazer.",2026-01-22
Limbo,Limbo,"He was in an emotional limbo, not knowing what to do with his life.","Ele estava num limbo emocional, sem saber o que fazer com a sua vida.",2026-01-22
Ingesting,Ingerindo,Ingesting healthy foods is essential for maintaining good health and energy throughout the day.,Ingerindo alimentos saudáveis é fundamental para manter uma boa saúde e energia ao longo do dia.,2026-01-22
Highlights,Destaques,The highlights of the meeting were discussed with all team members.,Os destaques da reunião foram discutidos com todos os membros da equipa.,2026-01-22
fell ill,adoeceu,He fell ill suddenly and had to miss work for a week.,Ele adoeceu de repente e teve de faltar ao trabalho durante uma semana.,2026-01-22
tight,apertado,The dress I bought is so tight that I can hardly breathe.,O vestido que comprei está tão apertado que mal consigo respirar.,2026-01-22
It's snowing,Está a nevar,"Today, it's snowing and the streets are covered with a white blanket.","Hoje, está a nevar e as ruas estão cobertas de um manto branco.",2026-01-22
Vigor,Vigor,It is important to maintain vigor and energy throughout the day to be productive.,É importante manter o vigor e a energia ao longo do dia para ser produtivo.,2026-01-22
clouds,nuvens,The clouds in the sky were so beautiful they looked hand-painted.,As nuvens no céu estavam tão bonitas que pareciam pintadas à mão.,2026-01-22
to see a label,ver rótulo,"Before buying, it's important to see the label to know the ingredients.","Antes de comprar, é importante ver o rótulo para saber os ingredientes.",2026-01-22
Side of the box,Lateral da caixa,The side of the box is damaged and we need a new one to replace it.,A lateral da caixa está danificada e precisamos de uma nova para substituir.,2026-01-22
Scratch my back,Coçar as minhas costas,"Sometimes, I need someone to help me scratch my back when I can't reach.","Às vezes, preciso de alguém para me ajudar a coçar as minhas costas quando não consigo alcançar.",2026-01-22
glazier,vidraceira,The glazier installed the new windows in the house in just one day.,A vidraceira instalou as novas janelas na casa em apenas um dia.,2026-01-22
Charging cable,Cabo de carregamento,The charging cable for my phone broke and I need a new one.,O cabo de carregamento do meu telemóvel avariou e preciso de um novo.,2026-01-22
to burn,queimar,"Be careful with the candle, don't let it burn unattended.","Cuidado com a vela, não a deixes queimar sem supervisão.",2026-01-22
Survey,Sondagem,The survey revealed that most people prefer to work remotely.,A sondagem revelou que a maioria das pessoas prefere trabalhar remotamente.,2026-01-22
Pepper mill,Moedor de pimenta,The pepper mill is essential to enhance the flavor of the dishes you cook.,O moedor de pimenta é essencial para realçar o sabor dos pratos que cozinhas.,2026-01-22
to dare,atrever-se,You need to dare to step out of your comfort zone to grow in life.,É preciso atrever-se a sair da zona de conforto para crescer na vida.,2026-01-22
oat milk,leite de aveia,Oat milk is a popular alternative to cow's milk among vegans.,O leite de aveia é uma alternativa popular ao leite de vaca entre os vegans.,2026-01-22
